{
  "id": "2026-10-23-star-of-bethnal-green-sam-redmore",
  "subcategory": "dj-bar",
  "title": "Sam Redmore",
  "summary": "Free Friday-night DJ session by Sam Redmore at the Star of Bethnal Green.",
  "venue": {
    "venue_id": "star-of-bethnal-green",
    "name": "The Star of Bethnal Green",
    "address": null,
    "postcode": null
  },
  "starts_at": "2026-10-23T21:00:00+01:00",
  "ends_at": "2026-10-24T02:00:00+01:00",
  "zone": "core",
  "lineup": [
    "Sam Redmore"
  ],
  "genres": [
    "funk",
    "disco",
    "house",
    "broken beat",
    "afrobeat",
    "latin"
  ],
  "price": {
    "known": true,
    "is_free": true,
    "min_gbp": 0,
    "max_gbp": 0,
    "notes": "Free"
  },
  "ticket_url": "https://ma.to/event/sam-redmore-the-star-of-bethnal-green-23-oct-2026",
  "evidence": [
    {
      "fields": [
        "title",
        "venue",
        "starts_at",
        "ends_at",
        "lineup",
        "price",
        "ticket_url"
      ],
      "url": "https://ma.to/event/sam-redmore-the-star-of-bethnal-green-23-oct-2026",
      "quote": "Sam Redmore When Friday, 23 October 21:00-02:00 Add to Calendar Price Free",
      "retrieved_at": "2026-10-12T22:45:00+01:00",
      "source_kind": "aggregator"
    },
    {
      "fields": [
        "starts_at"
      ],
      "url": "https://ma.to/event/sam-redmore-the-star-of-bethnal-green-23-oct-2026",
      "quote": "2026-10-23T21:00:00.000+01:00 2026-10-24T02:00:00.000+01:00",
      "retrieved_at": "2026-10-12T22:45:00+01:00",
      "source_kind": "aggregator"
    },
    {
      "fields": [
        "genres"
      ],
      "url": "https://ma.to/event/sam-redmore-the-star-of-bethnal-green-23-oct-2026",
      "quote": "a style that spans funk, disco, house, and broken beat through to afrobeat and latin sounds",
      "retrieved_at": "2026-10-12T22:45:00+01:00",
      "source_kind": "aggregator"
    }
  ],
  "scout_confidence": "medium",
  "why_its_good": "Free entry for a full Friday-night session from a Jalapeno Records producer, per the listing.",
  "notes_for_verifier": "Aggregator-only (ma.to); the venue has no primary listing online (registry no_primary_listing), so confidence capped at medium. The ma.to page gives no street address, so venue address left empty. Page also calls him 'the Jalapeno Records producer and BBC Radio 6 Music regular' (not used as a field).",
  "scout": {
    "name": "nights-music",
    "run_id": "2026-10-12-a"
  },
  "found_at": "2026-10-12T23:30:00+01:00",
  "category": "nights-music",
  "recurrence": null,
  "worth_the_trip": false,
  "age_restriction": null,
  "accessibility": null,
  "status": "scheduled"
}