{
  "id": "2026-10-16-sebright-arms-cowz",
  "subcategory": "gig",
  "title": "COWZ",
  "summary": "Headline show by COWZ with two support acts at the Sebright Arms.",
  "venue": {
    "venue_id": "sebright-arms",
    "name": "The Sebright Arms",
    "address": "31-35 Coate St, London",
    "postcode": "E2 9AG"
  },
  "starts_at": "2026-10-16T19:30:00+01:00",
  "zone": "core",
  "lineup": [
    "Cowz",
    "Tapwaterlucy",
    "EMiDORA"
  ],
  "genres": [],
  "price": {
    "known": true,
    "is_free": false,
    "min_gbp": 0,
    "max_gbp": null,
    "notes": "From free"
  },
  "ticket_url": "https://dice.fm/event/6a687972cc5f4f000118efc7",
  "age_restriction": "18+",
  "recurrence": null,
  "evidence": [
    {
      "fields": [
        "title",
        "venue",
        "starts_at",
        "ticket_url"
      ],
      "url": "https://dice.fm/event/6a687972cc5f4f000118efc7",
      "quote": "COWZ Sebright Arms Fri 16 Oct, 7:30 pm",
      "retrieved_at": "2026-10-12T22:45:00+01:00",
      "source_kind": "primary"
    },
    {
      "fields": [
        "starts_at"
      ],
      "url": "https://dice.fm/event/6a687972cc5f4f000118efc7",
      "quote": "2026-10-16T19:30:00+01:00 2026-10-16T23:00:00+01:00",
      "retrieved_at": "2026-10-12T22:45:00+01:00",
      "source_kind": "primary"
    },
    {
      "fields": [
        "price"
      ],
      "url": "https://dice.fm/event/6a687972cc5f4f000118efc7",
      "quote": "From free The price you'll pay",
      "retrieved_at": "2026-10-12T22:45:00+01:00",
      "source_kind": "primary"
    },
    {
      "fields": [
        "venue"
      ],
      "url": "https://dice.fm/event/6a687972cc5f4f000118efc7",
      "quote": "Sebright Arms 31-35 Coate St, London E2 9AG",
      "retrieved_at": "2026-10-12T22:45:00+01:00",
      "source_kind": "primary"
    },
    {
      "fields": [
        "age_restriction"
      ],
      "url": "https://dice.fm/event/6a687972cc5f4f000118efc7",
      "quote": "This is an 18+ event",
      "retrieved_at": "2026-10-12T22:45:00+01:00",
      "source_kind": "primary"
    },
    {
      "fields": [
        "lineup"
      ],
      "url": "https://dice.fm/event/6a687972cc5f4f000118efc7",
      "quote": "Lineup Cowz, Tapwaterlucy, EMiDORA",
      "retrieved_at": "2026-10-12T22:45:00+01:00",
      "source_kind": "primary"
    }
  ],
  "scout_confidence": "high",
  "why_its_good": null,
  "notes_for_verifier": "Read on DICE (the Sebright's own site is unreachable). DICE JSON-LD end time not shown in page text, so ends_at left empty. Venue name on DICE is 'Sebright Arms'. Price shown as 'From free'; tiers not visible.",
  "scout": {
    "name": "nights-music",
    "run_id": "2026-10-12-a"
  },
  "found_at": "2026-10-12T23:30:00+01:00",
  "category": "nights-music",
  "ends_at": null,
  "worth_the_trip": false,
  "accessibility": null,
  "status": "scheduled"
}