{
  "id": "2026-10-30-cafe-1001-athens-of-the-north-disco-club",
  "scout": {
    "name": "nights-music",
    "run_id": "2026-10-13-a"
  },
  "found_at": "2026-10-13T01:10:00+01:00",
  "category": "nights-music",
  "subcategory": "dj-bar",
  "title": "Athens of the North Disco Club",
  "summary": "An all-night Athens of the North disco and funk set at Cafe 1001 on Brick Lane, 7pm to midnight on Friday 30 October.",
  "venue": {
    "venue_id": "cafe-1001",
    "name": "Cafe 1001",
    "address": "91 Brick Lane, London",
    "postcode": "E1 6QL"
  },
  "starts_at": "2026-10-30T19:00:00+00:00",
  "ends_at": "2026-10-31T00:00:00+00:00",
  "recurrence": null,
  "zone": "fringe",
  "worth_the_trip": false,
  "lineup": [
    "Euan",
    "Lel"
  ],
  "genres": [
    "lost funk",
    "soul",
    "deep-disco",
    "leftfield house"
  ],
  "price": {
    "known": false
  },
  "ticket_url": "https://ma.to/event/athens-of-the-north-disco-club-30-oct-2026",
  "age_restriction": null,
  "accessibility": null,
  "status": "scheduled",
  "evidence": [
    {
      "fields": [
        "title",
        "starts_at",
        "ends_at",
        "ticket_url"
      ],
      "url": "https://ma.to/event/athens-of-the-north-disco-club-30-oct-2026",
      "quote": "Athens of the North Disco Club When Friday, 30 October 19:00-00:00",
      "retrieved_at": "2026-10-13T01:00:00+01:00",
      "source_kind": "aggregator"
    },
    {
      "fields": [
        "venue",
        "address",
        "postcode"
      ],
      "url": "https://ma.to/event/athens-of-the-north-disco-club-30-oct-2026",
      "quote": "Where Cafe 1001 91 Brick Lane, London, E1 6QL",
      "retrieved_at": "2026-10-13T01:00:00+01:00",
      "source_kind": "aggregator"
    },
    {
      "fields": [
        "lineup"
      ],
      "url": "https://ma.to/event/athens-of-the-north-disco-club-30-oct-2026",
      "quote": "Euan and Lel take over Cafe 1001 for an all-night set",
      "retrieved_at": "2026-10-13T01:00:00+01:00",
      "source_kind": "aggregator"
    },
    {
      "fields": [
        "genres"
      ],
      "url": "https://ma.to/event/athens-of-the-north-disco-club-30-oct-2026",
      "quote": "lost funk, soul, deep-disco, and leftfield house",
      "retrieved_at": "2026-10-13T01:00:00+01:00",
      "source_kind": "aggregator"
    },
    {
      "fields": [
        "price"
      ],
      "url": "https://ma.to/event/athens-of-the-north-disco-club-30-oct-2026",
      "quote": "Tickets for entry after 21:00 are available on the profile.",
      "retrieved_at": "2026-10-13T01:00:00+01:00",
      "source_kind": "aggregator"
    }
  ],
  "scout_confidence": "medium",
  "notes_for_verifier": "Venue marked no_primary_listing: ma.to is the only source. Cafe 1001's own site shows no events. The ma.to text says 'Euan and Lel' take over for the night."
}
