{
  "id": "2026-10-16-star-of-bethnal-green-jubel-dj-crooks-goons",
  "scout": {
    "name": "nights-music",
    "run_id": "2026-10-13-a"
  },
  "found_at": "2026-10-13T01:10:00+01:00",
  "category": "nights-music",
  "subcategory": "dj-bar",
  "title": "Jubel: DJ Crooks & Goons",
  "summary": "A Friday DJ night at The Star of Bethnal Green with DJ Crooks & Goons, 8pm to 2am, with the first 50 pints on the house, served 8pm to 9pm.",
  "venue": {
    "venue_id": "star-of-bethnal-green",
    "name": "The Star of Bethnal Green",
    "address": null,
    "postcode": null
  },
  "starts_at": "2026-10-16T20:00:00+01:00",
  "ends_at": "2026-10-17T02:00:00+01:00",
  "recurrence": null,
  "zone": "core",
  "worth_the_trip": false,
  "lineup": [
    "DJ Crooks & Goons"
  ],
  "genres": [],
  "price": {
    "known": false
  },
  "ticket_url": "https://ma.to/event/jubel-dj-crooks-goons-16-oct-2026",
  "age_restriction": null,
  "accessibility": null,
  "status": "scheduled",
  "evidence": [
    {
      "fields": [
        "title",
        "ticket_url"
      ],
      "url": "https://ma.to/event/jubel-dj-crooks-goons-16-oct-2026",
      "quote": "Jubel: DJ Crooks & Goons in London | Mato",
      "retrieved_at": "2026-10-13T01:00:00+01:00",
      "source_kind": "aggregator"
    },
    {
      "fields": [
        "starts_at",
        "ends_at"
      ],
      "url": "https://ma.to/event/jubel-dj-crooks-goons-16-oct-2026",
      "quote": "Friday, 16 October 20:00-02:00",
      "retrieved_at": "2026-10-13T01:00:00+01:00",
      "source_kind": "aggregator"
    },
    {
      "fields": [
        "venue"
      ],
      "url": "https://ma.to/event/jubel-dj-crooks-goons-16-oct-2026",
      "quote": "Where The Star of Bethnal Green",
      "retrieved_at": "2026-10-13T01:00:00+01:00",
      "source_kind": "aggregator"
    },
    {
      "fields": [
        "lineup"
      ],
      "url": "https://ma.to/event/jubel-dj-crooks-goons-16-oct-2026",
      "quote": "Jubel takes over the Friday night slot with DJ Crooks & Goons on the decks.",
      "retrieved_at": "2026-10-13T01:00:00+01:00",
      "source_kind": "aggregator"
    },
    {
      "fields": [
        "ends_at"
      ],
      "url": "https://ma.to/event/jubel-dj-crooks-goons-16-oct-2026",
      "quote": "Music runs until 02:00.",
      "retrieved_at": "2026-10-13T01:00:00+01:00",
      "source_kind": "aggregator"
    }
  ],
  "scout_confidence": "medium",
  "notes_for_verifier": "Re-recorded with the venue quoted from the ma.to event page (held on 12 Oct for a missing venue quote). Venue marked no_primary_listing: ma.to is the only source; the Star's own site is stale. Ticket link is the ma.to event page; no price on the page."
}
