{
  "id": "2026-10-24-colours-hoxton-sound-of-fashion-strictly-business",
  "scout": {
    "name": "nights-music",
    "run_id": "2026-10-14-a"
  },
  "found_at": "2026-10-14T06:20:00+01:00",
  "category": "nights-music",
  "subcategory": "club-night",
  "title": "Sound of Fashion: Strictly Business",
  "summary": "A club night at Colours Hoxton on Saturday 24 October with a fashion showroom, DJ sets and live acts. 18+.",
  "venue": {
    "venue_id": "colours-hoxton",
    "name": "Colours Hoxton",
    "address": null,
    "postcode": null
  },
  "starts_at": "2026-10-24T22:30:00+01:00",
  "ends_at": null,
  "recurrence": null,
  "zone": "outer",
  "worth_the_trip": true,
  "lineup": [],
  "genres": [],
  "price": {
    "known": true,
    "is_free": false,
    "min_gbp": 13.89,
    "max_gbp": null,
    "notes": null
  },
  "ticket_url": "https://dice.fm/event/nvrvxl-sound-of-fashion-strictly-business-24th-oct-colours-hoxton-london-tickets",
  "age_restriction": "18+",
  "accessibility": null,
  "status": "scheduled",
  "evidence": [
    {
      "fields": [
        "title",
        "venue"
      ],
      "url": "https://dice.fm/event/nvrvxl-sound-of-fashion-strictly-business-24th-oct-colours-hoxton-london-tickets",
      "quote": "Sound of Fashion: Strictly Business Tickets | 24 Oct | Colours Hoxton, London | DICE",
      "retrieved_at": "2026-10-14T06:10:00+01:00",
      "source_kind": "primary"
    },
    {
      "fields": [
        "starts_at"
      ],
      "url": "https://dice.fm/event/nvrvxl-sound-of-fashion-strictly-business-24th-oct-colours-hoxton-london-tickets",
      "quote": "Sat 24 Oct, 10:30 pm",
      "retrieved_at": "2026-10-14T06:10:00+01:00",
      "source_kind": "primary"
    },
    {
      "fields": [
        "starts_at"
      ],
      "url": "https://dice.fm/venue/colours-hoxton-mxew",
      "quote": "\"name\":\"Sound of Fashion: Strictly Business \",\"startDate\":\"2026-10-24T22:30:00+01:00\"",
      "retrieved_at": "2026-10-14T06:10:00+01:00",
      "source_kind": "primary"
    },
    {
      "fields": [
        "price"
      ],
      "url": "https://dice.fm/event/nvrvxl-sound-of-fashion-strictly-business-24th-oct-colours-hoxton-london-tickets",
      "quote": "\"lowPrice\":\"13.89\",\"highPrice\":\"13.89\"",
      "retrieved_at": "2026-10-14T06:10:00+01:00",
      "source_kind": "primary"
    },
    {
      "fields": [
        "age_restriction"
      ],
      "url": "https://dice.fm/event/nvrvxl-sound-of-fashion-strictly-business-24th-oct-colours-hoxton-london-tickets",
      "quote": "This is an 18+ event",
      "retrieved_at": "2026-10-14T06:10:00+01:00",
      "source_kind": "primary"
    },
    {
      "fields": [
        "subcategory"
      ],
      "url": "https://dice.fm/event/nvrvxl-sound-of-fashion-strictly-business-24th-oct-colours-hoxton-london-tickets",
      "quote": "Bringing together a curated fashion showroom + a lineup of DJ sets and live acts, all in one immersive club night experience.",
      "retrieved_at": "2026-10-14T06:10:00+01:00",
      "source_kind": "primary"
    },
    {
      "fields": [
        "subcategory"
      ],
      "url": "https://dice.fm/event/nvrvxl-sound-of-fashion-strictly-business-24th-oct-colours-hoxton-london-tickets",
      "quote": "After its debut in Glasgow and Manchester, Sound of Fashion is back in London for another epic night.",
      "retrieved_at": "2026-10-14T06:10:00+01:00",
      "source_kind": "primary"
    },
    {
      "fields": [
        "ticket_url"
      ],
      "url": "https://dice.fm/event/nvrvxl-sound-of-fashion-strictly-business-24th-oct-colours-hoxton-london-tickets",
      "quote": "Sound of Fashion: Strictly Business Tickets | 24 Oct | Colours Hoxton, London | DICE",
      "retrieved_at": "2026-10-14T06:10:00+01:00",
      "source_kind": "primary"
    }
  ],
  "scout_confidence": "high",
  "why_its_good": "A fashion showroom and DJ sets in one club night, back in London after Glasgow and Manchester.",
  "notes_for_verifier": "Colours Hoxton is a club in the registry; the DICE event page calls it a club night. Address not printed in the text read, so left empty."
}
