{
  "id": "2026-11-06-sebright-arms-insider-trading",
  "subcategory": "gig",
  "title": "Insider Trading",
  "summary": "Gig by Glasgow-based band Insider Trading with special guests at the Sebright Arms.",
  "venue": {
    "venue_id": "sebright-arms",
    "name": "The Sebright Arms",
    "address": "31-35 Coate St, London",
    "postcode": "E2 9AG"
  },
  "starts_at": "2026-11-06T19:30:00+00:00",
  "zone": "core",
  "lineup": [
    "Insider Trading"
  ],
  "genres": [
    "post-rock-with-choruses"
  ],
  "price": {
    "known": true,
    "is_free": false,
    "min_gbp": 11.44,
    "max_gbp": 11.44,
    "notes": "£11.44"
  },
  "ticket_url": "https://dice.fm/event/6a6c7fc3ca3d9500015813f4",
  "age_restriction": "18+",
  "recurrence": null,
  "evidence": [
    {
      "fields": [
        "title",
        "venue",
        "starts_at",
        "ticket_url"
      ],
      "url": "https://dice.fm/event/6a6c7fc3ca3d9500015813f4",
      "quote": "Insider Trading Sebright Arms Fri 6 Nov, 7:30 pm",
      "retrieved_at": "2026-10-12T22:45:00+01:00",
      "source_kind": "primary"
    },
    {
      "fields": [
        "starts_at"
      ],
      "url": "https://dice.fm/event/6a6c7fc3ca3d9500015813f4",
      "quote": "2026-11-06T19:30:00+00:00 2026-11-06T23:00:00+00:00",
      "retrieved_at": "2026-10-12T22:45:00+01:00",
      "source_kind": "primary"
    },
    {
      "fields": [
        "price"
      ],
      "url": "https://dice.fm/event/6a6c7fc3ca3d9500015813f4",
      "quote": "£11.44 The price you'll pay",
      "retrieved_at": "2026-10-12T22:45:00+01:00",
      "source_kind": "primary"
    },
    {
      "fields": [
        "venue"
      ],
      "url": "https://dice.fm/event/6a6c7fc3ca3d9500015813f4",
      "quote": "Sebright Arms 31-35 Coate St, London E2 9AG",
      "retrieved_at": "2026-10-12T22:45:00+01:00",
      "source_kind": "primary"
    },
    {
      "fields": [
        "age_restriction"
      ],
      "url": "https://dice.fm/event/6a6c7fc3ca3d9500015813f4",
      "quote": "This is an 18+ event",
      "retrieved_at": "2026-10-12T22:45:00+01:00",
      "source_kind": "primary"
    },
    {
      "fields": [
        "lineup"
      ],
      "url": "https://dice.fm/event/6a6c7fc3ca3d9500015813f4",
      "quote": "Lineup Insider Trading",
      "retrieved_at": "2026-10-12T22:45:00+01:00",
      "source_kind": "primary"
    },
    {
      "fields": [
        "genres"
      ],
      "url": "https://dice.fm/event/6a6c7fc3ca3d9500015813f4",
      "quote": "their unique brand of post-rock-with-choruses",
      "retrieved_at": "2026-10-12T22:45:00+01:00",
      "source_kind": "primary"
    }
  ],
  "scout_confidence": "high",
  "why_its_good": null,
  "notes_for_verifier": "Read on DICE (the Sebright's own site is unreachable). DICE JSON-LD end time not shown in page text, so ends_at left empty. Venue name on DICE is 'Sebright Arms'.",
  "scout": {
    "name": "nights-music",
    "run_id": "2026-10-12-a"
  },
  "found_at": "2026-10-12T23:30:00+01:00",
  "category": "nights-music",
  "ends_at": null,
  "worth_the_trip": false,
  "accessibility": null,
  "status": "scheduled"
}