{
  "id": "2026-10-15-sebright-arms-m-x-as-rome-burns-bone-china",
  "subcategory": "gig",
  "title": "M/X + As Rome Burns + Bone China",
  "summary": "Free three-band gig headlined by Bristol trio M/X at the Sebright Arms.",
  "venue": {
    "venue_id": "sebright-arms",
    "name": "The Sebright Arms",
    "address": "31-35 Coate St, London",
    "postcode": "E2 9AG"
  },
  "starts_at": "2026-10-15T19:30:00+01:00",
  "zone": "core",
  "lineup": [
    "M/X",
    "As Rome Burns",
    "Bone China"
  ],
  "genres": [
    "dream punk",
    "post punk",
    "grunge"
  ],
  "price": {
    "known": true,
    "is_free": true,
    "min_gbp": 0,
    "max_gbp": 0,
    "notes": "Free"
  },
  "ticket_url": "https://dice.fm/event/69fc6945841dc500010c443a",
  "age_restriction": "18+",
  "recurrence": null,
  "evidence": [
    {
      "fields": [
        "title",
        "venue",
        "starts_at",
        "ticket_url"
      ],
      "url": "https://dice.fm/event/69fc6945841dc500010c443a",
      "quote": "M/X + As Rome Burns + Bone China Sebright Arms Thu 15 Oct, 7:30 pm",
      "retrieved_at": "2026-10-12T22:45:00+01:00",
      "source_kind": "primary"
    },
    {
      "fields": [
        "starts_at"
      ],
      "url": "https://dice.fm/event/69fc6945841dc500010c443a",
      "quote": "2026-10-15T19:30:00+01:00 2026-10-15T23:00:00+01:00",
      "retrieved_at": "2026-10-12T22:45:00+01:00",
      "source_kind": "primary"
    },
    {
      "fields": [
        "price"
      ],
      "url": "https://dice.fm/event/69fc6945841dc500010c443a",
      "quote": "Free The price you'll pay",
      "retrieved_at": "2026-10-12T22:45:00+01:00",
      "source_kind": "primary"
    },
    {
      "fields": [
        "venue"
      ],
      "url": "https://dice.fm/event/69fc6945841dc500010c443a",
      "quote": "Sebright Arms 31-35 Coate St, London E2 9AG",
      "retrieved_at": "2026-10-12T22:45:00+01:00",
      "source_kind": "primary"
    },
    {
      "fields": [
        "age_restriction"
      ],
      "url": "https://dice.fm/event/69fc6945841dc500010c443a",
      "quote": "This is an 18+ event",
      "retrieved_at": "2026-10-12T22:45:00+01:00",
      "source_kind": "primary"
    },
    {
      "fields": [
        "lineup"
      ],
      "url": "https://dice.fm/event/69fc6945841dc500010c443a",
      "quote": "Lineup M/X, As Rome Burns, Bone China",
      "retrieved_at": "2026-10-12T22:45:00+01:00",
      "source_kind": "primary"
    },
    {
      "fields": [
        "genres"
      ],
      "url": "https://dice.fm/event/69fc6945841dc500010c443a",
      "quote": "M/X is a young and eclectic three-piece dream punk powerhouse that fuses post punk with grunge and indie gaze.",
      "retrieved_at": "2026-10-12T22:45:00+01:00",
      "source_kind": "primary"
    }
  ],
  "scout_confidence": "high",
  "why_its_good": "Free three-band bill at the Sebright, per the DICE listing.",
  "notes_for_verifier": "Read on DICE (the Sebright's own site is unreachable). DICE JSON-LD end time not shown in page text, so ends_at left empty. Venue name on DICE is 'Sebright Arms'.",
  "scout": {
    "name": "nights-music",
    "run_id": "2026-10-12-a"
  },
  "found_at": "2026-10-12T23:30:00+01:00",
  "category": "nights-music",
  "ends_at": null,
  "worth_the_trip": false,
  "accessibility": null,
  "status": "scheduled"
}